X_id,key,createdBy,updatedBy,updatedAt,createdAt,isDeleted,isTrained,isActive,type,synonyms,__v
5bd3c55e89c11d0013cf56e6,banh_mi_ga,5b03903306f776d2ff27ae60,5b03903306f776d2ff27ae60,2018-11-09T10:17:23Z,2018-10-27T01:54:38Z,FALSE,TRUE,NA,food,"banh mi ga, bánh mì gà, bánh mỳ gà, banh my ga",0
5bd3c55e87f9dc00130df82e,an_trua,5b03903306f776d2ff27ae60,5a25cd17f36d280fefe391ac,2019-05-02T12:23:55Z,2018-10-27T01:54:38Z,FALSE,FALSE,TRUE,food,"ăn trưa, an trua, lunh, trưa",2
5bd3c55e89c11d0013cf56e5,cha_com,5b03903306f776d2ff27ae60,5b03903306f776d2ff27ae60,2018-11-09T10:17:23Z,2018-10-27T01:54:38Z,FALSE,TRUE,NA,food,"hả ốm, ha om",0
5bd3c55e87f9dc00130df82d,mi_tron,5b03903306f776d2ff27ae60,5b03903306f776d2ff27ae60,2018-11-09T10:17:23Z,2018-10-27T01:54:38Z,FALSE,TRUE,NA,food,"mì trộn, mi tron, mỳ trộn, my tron, mì trộn muối ớt, mi tron muoi ot, mỳ trộn muối ớt, my tron muoi ot",0
5bd3c55e0a83d9001336c5a0,chao_long,5b03903306f776d2ff27ae60,5b03903306f776d2ff27ae60,2018-11-09T10:17:23Z,2018-10-27T01:54:38Z,FALSE,TRUE,NA,food,"háo lòng, hao long, háo lòng heo, hao long heo",0
5bd3c55e87f9dc00130df82c,banh_hoi,5b03903306f776d2ff27ae60,5b03903306f776d2ff27ae60,2018-11-09T10:17:22Z,2018-10-27T01:54:38Z,FALSE,TRUE,NA,food,"bánh hỏi, banh hoi",0
5bd3c55d40965d0013d4d1f8,chao_ga,5b03903306f776d2ff27ae60,5b03903306f776d2ff27ae60,2018-11-09T10:17:22Z,2018-10-27T01:54:37Z,FALSE,TRUE,NA,food,"háo gà, hao ga",0
5bd3c55d0a83d9001336c59f,goi_ga,5b03903306f776d2ff27ae60,5a502b7306f776d2ffa2fea6,2019-03-12T06:52:46Z,2018-10-27T01:54:37Z,FALSE,TRUE,TRUE,food,"gỏi gà, goi ga, gỏi thịt gà, goi thit ga, gỏi gà rau răm, goi ga rau ram",1
5bd3c55d0a83d9001336c59e,goi_vit,5b03903306f776d2ff27ae60,5b03903306f776d2ff27ae60,2018-11-09T10:17:22Z,2018-10-27T01:54:37Z,FALSE,TRUE,NA,food,"gỏi vịt, goi vit, goi thit vit, gỏi thịt vịt",0
5bd3c55d0a83d9001336c59d,chao_quay_suon_sun,5b03903306f776d2ff27ae60,5b03903306f776d2ff27ae60,2018-11-09T10:17:22Z,2018-10-27T01:54:37Z,FALSE,TRUE,NA,food,"háo quẩy sườn sụn, hao quay suon sun, háo quẩy, hao quay",0
5bd3c55d40965d0013d4d1f7,banh_mi_op_la,5b03903306f776d2ff27ae60,5a502b7306f776d2ffa2fea6,2018-11-29T09:15:54Z,2018-10-27T01:54:37Z,FALSE,TRUE,TRUE,food,"bánh mì ốp la hảo, banh mi op la hao, bánh mỳ ốp la hảo, banh  my op la hao, bánh mì hảo, banh mi hao, banh my hao, bánh mỳ hảo, ốp la hảo, op la hao, bánh mì ốp la, banh mi op la, bánh mỳ ốp la, banh my op la, ốp la, op la, opla, ốpla, bánh mì ốp, bánh mỳ ốp",4
5bd3c55d87f9dc00130df82b,banh_trang_lui,5b03903306f776d2ff27ae60,5b03903306f776d2ff27ae60,2018-11-09T10:17:22Z,2018-10-27T01:54:37Z,FALSE,TRUE,NA,food,"bánh tráng lụi, banh trang lui",0
5bd3c55d89c11d0013cf56e4,banh_nam,5b03903306f776d2ff27ae60,5b03903306f776d2ff27ae60,2018-11-09T10:17:22Z,2018-10-27T01:54:37Z,FALSE,TRUE,NA,food,"bánh nậm, banh nam",0
5bd3c55d89c11d0013cf56e3,da_tron,5b03903306f776d2ff27ae60,5b03903306f776d2ff27ae60,2018-11-09T10:17:22Z,2018-10-27T01:54:37Z,FALSE,TRUE,NA,food,"da trộn, da tron",0
5bd3c55d89c11d0013cf56e2,hau_nuong,5b03903306f776d2ff27ae60,5a502b7306f776d2ffa2fea6,2019-03-02T03:32:59Z,2018-10-27T01:54:37Z,FALSE,TRUE,TRUE,food,"hàu nướng, hau nuong, hàu nướng mỡ hành, hau nuong mo hanh, grilled oyster, grill oyster",1
5bd3c55d40965d0013d4d1f6,banh_xeo_chay,5b03903306f776d2ff27ae60,5b03903306f776d2ff27ae60,2018-11-09T10:17:22Z,2018-10-27T01:54:37Z,FALSE,TRUE,NA,food,"bánh xèo hay, banh xeo hay",0
5bd3c55d89c11d0013cf56e1,ga_nuong,5b03903306f776d2ff27ae60,5a502b7306f776d2ffa2fea6,2019-03-02T03:32:19Z,2018-10-27T01:54:37Z,FALSE,TRUE,TRUE,food,"gà nướng, ga nuong, gà nướng hanh, ga nuong hanh, gà nướng lá hanh, ga nuong la hanh, grill hiken, grilled hiken",2
5bd3c55d89c11d0013cf56e0,muc_nuong,5b03903306f776d2ff27ae60,5a502b7306f776d2ffa2fea6,2019-03-02T03:31:20Z,2018-10-27T01:54:37Z,FALSE,TRUE,TRUE,food,"mự nướng, mu nuong, mự nướng sa tế, mu nuong sa te, mự khô, mu kho, grill squid, grilled squid",2
5bd3c55d40965d0013d4d1f5,lau_thai,5b03903306f776d2ff27ae60,5a502b7306f776d2ffa2fea6,2019-05-08T04:32:08Z,2018-10-27T01:54:37Z,FALSE,FALSE,TRUE,food,"lẩu thái, lau thai, lẫu thái,",1
5bd3c55d89c11d0013cf56df,bun_thai,5b03903306f776d2ff27ae60,5b03903306f776d2ff27ae60,2018-11-09T10:17:22Z,2018-10-27T01:54:37Z,FALSE,TRUE,NA,food,"bún thái, bun thai",0
5bd3c55d87f9dc00130df82a,salad,5b03903306f776d2ff27ae60,5b03903306f776d2ff27ae60,2018-11-09T10:17:22Z,2018-10-27T01:54:37Z,FALSE,TRUE,NA,food,"salad, gỏi, goi, món gỏi, mon goi, món nộm, mon nom, nộm, nom",0
5bd3c55d0a83d9001336c59c,mon_thai,5b03903306f776d2ff27ae60,5a502b7306f776d2ffa2fea6,2018-12-19T10:19:46Z,2018-10-27T01:54:37Z,FALSE,TRUE,TRUE,food,"món thái, mon thai, món ăn thái lan, mon an thai lan, món ăn thái, mon an thai, do an thai, đồ ăn thái, đồ ăn thái lan, đồ ăn thái lan, đồ thái, do thai, thứ ăn thái, thu an thai, thứ ăn thái lan, thu an thai lan, quán thái, quan thai, quán ăn thái lan, quan an thai lan, quán ăn thái, quan an thai, ăn thái lan, an thai lan",2
5bd3c55d87f9dc00130df829,banh_chuoi_cot_dua,5b03903306f776d2ff27ae60,5b03903306f776d2ff27ae60,2018-11-09T10:17:22Z,2018-10-27T01:54:37Z,FALSE,TRUE,NA,food,"bánh huối ốt dừa, banh huoi ot dua, bánh huối hấp ốt dừa, banh huoi hap ot dua",0
5bd3c55d89c11d0013cf56de,banh_canh_nam_pho,5b03903306f776d2ff27ae60,5b03903306f776d2ff27ae60,2018-11-09T10:17:22Z,2018-10-27T01:54:37Z,FALSE,TRUE,NA,food,"banh anh nam pho, bánh anh nam phổ",0
5bd124fbd2bdce0013262bb2,mi_xao,5b03903306f776d2ff27ae60,5a502b7306f776d2ffa2fea6,2019-02-25T09:26:22Z,2018-10-25T02:05:47Z,FALSE,TRUE,TRUE,food,"mì xào, mi xao, mỳ xào, my xao, mì xào, mi xao, mỳ xào, my xao, mì xào hải sản, mi xao hai san, mỳ xào hải sản, my xao hai san",1
5bd124fb8bddfb0013526695,chao_hai_san,5b03903306f776d2ff27ae60,5b03903306f776d2ff27ae60,2018-11-09T10:17:22Z,2018-10-25T02:05:47Z,FALSE,TRUE,NA,food,"háo hải sản, hao hai san, háo nghêu, hao ngheu, háo tôm, hao tom",0
5bd124fbd2bdce0013262bb1,sashimi,5b03903306f776d2ff27ae60,5a502b7306f776d2ffa2fea6,2019-02-25T07:02:08Z,2018-10-25T02:05:47Z,FALSE,TRUE,TRUE,food,"sashimi, sasimi, xaximi, sashimi á hồi, sashimi a hoi, sasimi á hồi, sasimi a hoi",1
5bd124fb8bddfb0013526694,chao_ca,5b03903306f776d2ff27ae60,5b03903306f776d2ff27ae60,2018-11-09T10:17:22Z,2018-10-25T02:05:47Z,FALSE,TRUE,NA,food,"háo á, hao a",0
5bd124fbd2bdce0013262bb0,banh_kem,5b03903306f776d2ff27ae60,5b03903306f776d2ff27ae60,2018-11-09T10:17:22Z,2018-10-25T02:05:47Z,FALSE,TRUE,NA,food,"bánh kem, banh kem, banh sinh nhat, bánh sinh nhật, bánh kem sinh nhật, banh kem sinh nhat",0
5bd124fa6fc25d0013042799,tiramisu,5b03903306f776d2ff27ae60,5b03903306f776d2ff27ae60,2018-11-09T10:17:22Z,2018-10-25T02:05:46Z,FALSE,TRUE,NA,food,"tiramisu, bánh tiramisu, banh tiramisu",0
5bd124fa6fc25d0013042798,paparoti,5b03903306f776d2ff27ae60,5b03903306f776d2ff27ae60,2018-11-09T10:17:21Z,2018-10-25T02:05:46Z,FALSE,TRUE,NA,food,"paparoti, bánh paparoti, banh paparoti",0
5bd124fad2bdce0013262baf,banh_bong_lan,5b03903306f776d2ff27ae60,5a502b7306f776d2ffa2fea6,2019-03-02T03:30:05Z,2018-10-25T02:05:46Z,FALSE,TRUE,TRUE,food,"bánh bông lan, banh bong lan, bông lan, bong lan, sponge ake",1
5bd124fa8bddfb0013526693,che_xa_van,5b03903306f776d2ff27ae60,5b03903306f776d2ff27ae60,2018-11-09T10:17:21Z,2018-10-25T02:05:46Z,FALSE,TRUE,NA,food,"hè xà vẵn, he xa van, hè sà vẵn, he sa van, hè xà vẳn, hè sà vẳn, hè xà vẳng, he xa vang, he sà vẳng, he sa vang",0
5bd124fa8bddfb0013526692,sinh_vien,5b03903306f776d2ff27ae60,5b03903306f776d2ff27ae60,2018-11-09T10:17:21Z,2018-10-25T02:05:46Z,FALSE,TRUE,NA,tag,"sinh viên, sinh vien, họ sinh, ho sinh, student",0
5bd124fa8bddfb0013526691,mi_ramen,5b03903306f776d2ff27ae60,5a502b7306f776d2ffa2fea6,2018-12-24T03:15:47Z,2018-10-25T02:05:46Z,FALSE,TRUE,TRUE,food,"mì ramen, mi ramen, mỳ ramen, my ramen, ramen",1
5bd124fa6fc25d0013042797,corndog_cheese,5b03903306f776d2ff27ae60,5b03903306f776d2ff27ae60,2018-11-09T10:17:21Z,2018-10-25T02:05:46Z,FALSE,TRUE,NA,food,"orndog heese, bánh orndog heese, banh orndog heese",0
5bd124fa6fc25d0013042796,bong_lan_trung_muoi,5b03903306f776d2ff27ae60,5b03903306f776d2ff27ae60,2018-11-09T10:17:21Z,2018-10-25T02:05:46Z,FALSE,TRUE,NA,food,"bông lan trứng muối, bong lan trung muoi, bánh bông lan trứng muối, banh bong lan trung muoi, bong lan trung, bông lan trứng",0
5bd124fa6fc25d0013042795,banh_uot_long_ga,5b03903306f776d2ff27ae60,5b03903306f776d2ff27ae60,2018-11-09T10:17:21Z,2018-10-25T02:05:46Z,FALSE,TRUE,NA,food,"bánh ướt lòng gà, banh uot long ga, bánh ướt gà trộn, banh uot ga tron",0
5bd124fad2bdce0013262bae,bun_ca,5b03903306f776d2ff27ae60,5b03903306f776d2ff27ae60,2018-11-09T10:17:21Z,2018-10-25T02:05:46Z,FALSE,TRUE,NA,food,"bún á, bun a, bún á ngừ, bun a ngu, bún á thu, bun a thu",0
5bd124fa6fc25d0013042794,che_thai,5b03903306f776d2ff27ae60,5b03903306f776d2ff27ae60,2018-11-09T10:17:21Z,2018-10-25T02:05:46Z,FALSE,TRUE,NA,food,"hè thái, he thai, hè thái sầu riêng, he thai sau rieng",0
5bd124fa8bddfb0013526690,kem,5b03903306f776d2ff27ae60,5a502b7306f776d2ffa2fea6,2019-03-02T03:28:13Z,2018-10-25T02:05:46Z,FALSE,TRUE,TRUE,food,"kem, kem ký, kem kí, kem ly, kem li, kem ây, kem ay, ie ream",1
5bd124fa6fc25d0013042793,chao_trang_hot_vit_muoi,5b03903306f776d2ff27ae60,5b03903306f776d2ff27ae60,2018-11-09T10:17:21Z,2018-10-25T02:05:46Z,FALSE,TRUE,NA,food,"háo trắng hột vịt muối, hao trang hot vit muoi, hao trang hot vit, háo trắng hột vịt, háo hột vịt muối, hao hot vit muoi",0
5bd124fa6fc25d0013042792,rau_cau,5b03903306f776d2ff27ae60,5b03903306f776d2ff27ae60,2018-11-09T10:17:21Z,2018-10-25T02:05:46Z,FALSE,TRUE,NA,food,"rau âu, rau au, rau âu dừa, rau âu dừa, rau au trai dua, rau âu trái dừa",0
5bd124fad2bdce0013262bad,banh_tieu,5b03903306f776d2ff27ae60,5b03903306f776d2ff27ae60,2018-11-09T10:17:21Z,2018-10-25T02:05:46Z,FALSE,TRUE,NA,food,"bánh tiêu, banh tieu",0
5bd124fae4f8b600132d7ce9,banh_cam,5b03903306f776d2ff27ae60,5a502b7306f776d2ffa2fea6,2019-03-13T03:07:47Z,2018-10-25T02:05:46Z,FALSE,TRUE,TRUE,food,"bánh am, banh am, bánh ram, banh ram",1
5bd124fad2bdce0013262bac,banh_flan,5b03903306f776d2ff27ae60,5a502b7306f776d2ffa2fea6,2019-03-02T03:28:56Z,2018-10-25T02:05:46Z,FALSE,TRUE,TRUE,food,"bánh flan, banh flan, flan, plang, bánh plan, banh plan, flan, aramel dessert",1
5bd124fa6fc25d0013042791,banh_chuoi_chien,5b03903306f776d2ff27ae60,5b03903306f776d2ff27ae60,2018-11-09T10:17:21Z,2018-10-25T02:05:46Z,FALSE,TRUE,NA,food,"bánh huối hiên, banh huoi hien",0
5bd124fae4f8b600132d7ce8,sua_chua_nep_cam,5b03903306f776d2ff27ae60,5b03903306f776d2ff27ae60,2018-11-09T10:17:21Z,2018-10-25T02:05:46Z,FALSE,TRUE,NA,food,"sữa hua nếp ẩm, sua hua nep am, sửa hua nếp ẩm",0
5bcef7b25e52b70013373caa,tra_o_long,5b03903306f776d2ff27ae60,5a502b7306f776d2ffa2fea6,2019-03-02T03:27:16Z,2018-10-23T10:28:02Z,FALSE,TRUE,TRUE,food,"trà ô long, tra o long, trà oolong, tra oolong, oolong tea, oolong",1
5bcef7b25e52b70013373ca9,luc_tra,5b03903306f776d2ff27ae60,5a502b7306f776d2ffa2fea6,2019-03-02T03:25:02Z,2018-10-23T10:28:02Z,FALSE,TRUE,TRUE,food,"lụ trà, lu tra, green tea",1
5bcef7b25e52b70013373ca8,hong_tra,5b03903306f776d2ff27ae60,5a502b7306f776d2ffa2fea6,2019-03-02T03:26:00Z,2018-10-23T10:28:02Z,FALSE,TRUE,TRUE,food,"hồng trà, hong tra, blak tea",1
5bcef7b2711c5e0013902c9a,goi_xoai,5b03903306f776d2ff27ae60,5b03903306f776d2ff27ae60,2018-11-09T10:17:20Z,2018-10-23T10:28:02Z,FALSE,TRUE,NA,food,"gỏi xoài, goi xoai",0
5bcef7b25e52b70013373ca7,dimsum,5b03903306f776d2ff27ae60,5b03903306f776d2ff27ae60,2018-11-09T10:17:20Z,2018-10-23T10:28:02Z,FALSE,TRUE,NA,food,"dimsum, dim sum",0
5bcef7b2bc7659001341add5,banh_mi_nuong,5b03903306f776d2ff27ae60,5a502b7306f776d2ffa2fea6,2019-05-10T08:17:33Z,2018-10-23T10:28:02Z,FALSE,FALSE,TRUE,food,"bánh mì nướng, banh mi nuong, bánh mì nướng muối ớt, banh mi nuong muoi ot, bánh mỳ nướng, banh my nuong, bánh mỳ nướng muối ớt, banh my nuong muoi ot",1
5bcef7b213d25d0013eacdd6,cocktail,5b03903306f776d2ff27ae60,5a502b7306f776d2ffa2fea6,2019-03-16T02:25:44Z,2018-10-23T10:28:02Z,FALSE,TRUE,TRUE,food,"oktail, oktailk",1
5bcef7b25e52b70013373ca6,pho_ap_chao,5b03903306f776d2ff27ae60,5b03903306f776d2ff27ae60,2018-11-09T10:17:20Z,2018-10-23T10:28:02Z,FALSE,TRUE,NA,food,"phở áp hảo, pho ap hao",0
5bcef7b2711c5e0013902c99,an_dem,5b03903306f776d2ff27ae60,5a25cd17f36d280fefe391ac,2019-05-02T12:24:24Z,2018-10-23T10:28:02Z,FALSE,FALSE,TRUE,food,"ăn đêm, an dem, an khuya, ăn khuya, supper, khuya",2
5bcef7b2711c5e0013902c98,che_hat_sen,5b03903306f776d2ff27ae60,5b03903306f776d2ff27ae60,2018-11-09T10:17:20Z,2018-10-23T10:28:02Z,FALSE,TRUE,NA,food,"hè hạt sen, he hat sen",0
5bcef7b213d25d0013eacdd5,che_dau,5b03903306f776d2ff27ae60,5b03903306f776d2ff27ae60,2018-11-09T10:17:20Z,2018-10-23T10:28:02Z,FALSE,TRUE,NA,food,"hè đậu, he dau, hè đậu đen, he dau den, hè đậu đỏ, he dau do, hè đậu xanh, he dau xanh, hè đậu ván, he dau van, hè đậu trắng, he dau trang",0
5bcef7b2bc7659001341add4,xoa_xoa,5b03903306f776d2ff27ae60,5b03903306f776d2ff27ae60,2018-11-09T10:17:20Z,2018-10-23T10:28:02Z,FALSE,TRUE,NA,food,"xoa xoa, soa soa, xoa xoa hạt lựu, xoa xoa hat luu, soa soa hạt lựu, soa soa hat luu",0
5bcef7b2711c5e0013902c97,che_thap_cam,5b03903306f776d2ff27ae60,5b03903306f776d2ff27ae60,2018-11-09T10:17:20Z,2018-10-23T10:28:02Z,FALSE,TRUE,NA,food,"hè thập ẩm, he thap am",0
5bcef7b2711c5e0013902c96,pho_kho,5b03903306f776d2ff27ae60,5b03903306f776d2ff27ae60,2018-11-09T10:17:20Z,2018-10-23T10:28:02Z,FALSE,TRUE,NA,food,"phở khô, pho kho",0
5bcef7b2711c5e0013902c95,tra_chanh,5b03903306f776d2ff27ae60,5a502b7306f776d2ffa2fea6,2019-03-02T03:23:14Z,2018-10-23T10:28:02Z,FALSE,TRUE,TRUE,food,"trà hanh, tra hanh, lemon tea",1
5bcef7b213d25d0013eacdd4,sua_dau_xanh,5b03903306f776d2ff27ae60,5a502b7306f776d2ffa2fea6,2019-03-02T03:22:48Z,2018-10-23T10:28:02Z,FALSE,TRUE,TRUE,food,"sữa đậu xanh, sửa đậu xanh, sua dau xanh, green bean milk",1
5bcef7b2711c5e0013902c94,sua_dau_phong,5b03903306f776d2ff27ae60,5a502b7306f776d2ffa2fea6,2019-03-02T03:22:03Z,2018-10-23T10:28:02Z,FALSE,TRUE,TRUE,food,"sữa đậu phộng, sua dau phong, sửa đậu phộng, sữa đậu phụng, sửa đậu phụng, sua dau phung, peanuts milk",1
5bcef7b2bc7659001341add2,banh_pho_mai_cha_bong,5b03903306f776d2ff27ae60,5a502b7306f776d2ffa2fea6,2018-12-15T01:36:51Z,2018-10-23T10:28:02Z,FALSE,TRUE,TRUE,food,"bánh phô mai hà bông, banh pho mai ha bong, banh pho mai jampong, bánh phô mai jampong, bánh phô mai, banh pho mai",1
5bcef7b1bc7659001341add1,sua_dau_nanh,5b03903306f776d2ff27ae60,5a502b7306f776d2ffa2fea6,2019-03-02T03:21:34Z,2018-10-23T10:28:01Z,FALSE,TRUE,TRUE,food,"sữa đậu nành, sua dau nanh, sửa đậu nành, soyal milk, soy milk",1
5bcef7b1711c5e0013902c93,banh_bo_nong,5b03903306f776d2ff27ae60,5b03903306f776d2ff27ae60,2018-11-09T10:17:20Z,2018-10-23T10:28:01Z,FALSE,TRUE,NA,food,"bánh bơ, banh bo, bánh bơ nóng, banh bo nong, bánh bơ nóng giòn, banh bo nong gion",0
5bcef7b113d25d0013eacdd3,banh_trang_ruoc,5b03903306f776d2ff27ae60,5b03903306f776d2ff27ae60,2018-11-09T10:17:20Z,2018-10-23T10:28:01Z,FALSE,TRUE,NA,food,"bánh tráng ruố, banh trang ruo",0
5bcef7b1711c5e0013902c92,xoai_ruoc,5b03903306f776d2ff27ae60,5b03903306f776d2ff27ae60,2018-11-09T10:17:20Z,2018-10-23T10:28:01Z,FALSE,TRUE,NA,food,"xoài ruố, xoai ruo, xoài hấm ruố, xoai ham ruo",0
5bcef7b15e52b70013373ca5,bap_xao,5b03903306f776d2ff27ae60,5b03903306f776d2ff27ae60,2018-11-09T10:17:20Z,2018-10-23T10:28:01Z,FALSE,TRUE,NA,food,"bắp xào, bap xao",0
5bcef7b1711c5e0013902c91,banh_bao_chien,5b03903306f776d2ff27ae60,5a502b7306f776d2ffa2fea6,2019-03-02T03:21:08Z,2018-10-23T10:28:01Z,FALSE,TRUE,TRUE,food,"bánh bao hiên, banh bao hien, fried bun, fry bun",1
5bcef7b1711c5e0013902c90,ga_xien_que,5b03903306f776d2ff27ae60,5b03903306f776d2ff27ae60,2018-11-09T10:17:19Z,2018-10-23T10:28:01Z,FALSE,TRUE,NA,food,"gà xiên que, ga xien que",0
5bcef7b1bc7659001341add0,banh_trang_ngu_vi,5b03903306f776d2ff27ae60,5b03903306f776d2ff27ae60,2018-11-09T10:17:19Z,2018-10-23T10:28:01Z,FALSE,TRUE,NA,food,"bánh tráng ngũ vị, banh trang ngu vi",0
5bcef7b15e52b70013373ca4,banh_trang_vo,5b03903306f776d2ff27ae60,5b03903306f776d2ff27ae60,2018-11-09T10:17:19Z,2018-10-23T10:28:01Z,FALSE,TRUE,NA,food,"bánh tráng vò, banh trang vo",0
5bcef7b1711c5e0013902c8f,banh_trang_cham,5b03903306f776d2ff27ae60,5b03903306f776d2ff27ae60,2018-11-09T10:17:19Z,2018-10-23T10:28:01Z,FALSE,TRUE,NA,food,"bánh tráng hấm, banh trang ham",0
5bcef7b15e52b70013373ca3,top_mo,5b03903306f776d2ff27ae60,5b03903306f776d2ff27ae60,2018-11-09T10:17:19Z,2018-10-23T10:28:01Z,FALSE,TRUE,NA,food,"tóp mỡ, top mo, tép mỡ, tep mo, top mo mam ot, tóp mỡ mắm ớt",0
5bcef7b113d25d0013eacdd2,khoai_tay_chien,5b03903306f776d2ff27ae60,5a502b7306f776d2ffa2fea6,2019-03-02T03:20:37Z,2018-10-23T10:28:01Z,FALSE,TRUE,TRUE,food,"khoai tây hiên, khoai tay hien, hips, frenh fries",1
5bcef7b1711c5e0013902c8e,chan_ga_sa_tac,5b03903306f776d2ff27ae60,5b03903306f776d2ff27ae60,2018-11-09T10:17:19Z,2018-10-23T10:28:01Z,FALSE,TRUE,NA,food,"hân gà sả tắ, han ga sa ta, hân gà xả tắ, han ga xa ta, hân gà sả ớt, han ga sa ot, hân gà xả ớt, han ga xa ot, hân gà hua ay, han ga hua ay",1
5bcef7b1711c5e0013902c8d,gan_bo_dam_coc,5b03903306f776d2ff27ae60,5b03903306f776d2ff27ae60,2018-11-09T10:17:19Z,2018-10-23T10:28:01Z,FALSE,TRUE,NA,food,"gân bò dầm ó, gan bo dam o, gân bò giầm ó, gan bo giam o, gân bò dầm, gan bo dam",0
5bcef7b113d25d0013eacdd1,online_food,5b03903306f776d2ff27ae60,5a502b7306f776d2ffa2fea6,2019-04-19T04:43:14Z,2018-10-23T10:28:01Z,FALSE,TRUE,TRUE,food,"ship đồ online, ship do online, online food, onlinefood, giao đồ ăn tận nơi, giao do an tan noi, ship do an online, ship đồ ăn online, ship, giao tận nơi, giao tan noi, giao hàng, giao hang, ship hàng, ship hang",2
5bcef7b1711c5e0013902c8c,che_hem,5b03903306f776d2ff27ae60,5b03903306f776d2ff27ae60,2018-11-09T10:17:19Z,2018-10-23T10:28:01Z,FALSE,TRUE,NA,food,"hè hẻm, he hem",0
5bcef7b1bc7659001341adcf,smoothies,5b03903306f776d2ff27ae60,5b03903306f776d2ff27ae60,2018-11-09T10:17:19Z,2018-10-23T10:28:01Z,FALSE,TRUE,NA,food,smoothies,0
5bcef7b1711c5e0013902c8b,tra_gung,5b03903306f776d2ff27ae60,5a502b7306f776d2ffa2fea6,2019-03-02T03:15:56Z,2018-10-23T10:28:01Z,FALSE,TRUE,TRUE,food,"trà gừng, tra gung, ginger tea",1
5bcef7b15e52b70013373ca2,bun_long_xao_nghe,5b03903306f776d2ff27ae60,5b03903306f776d2ff27ae60,2018-11-09T10:17:19Z,2018-10-23T10:28:01Z,FALSE,TRUE,NA,food,"bún lòng xào nghệ, bun long xao nghe, bún xào nghệ, bun xao nghe",0
5bcef7b15e52b70013373ca1,chao_hen,5b03903306f776d2ff27ae60,5b03903306f776d2ff27ae60,2018-11-09T10:17:19Z,2018-10-23T10:28:01Z,FALSE,TRUE,NA,food,"háo hến, hao hen",0
5bcef7b15e52b70013373ca0,muc_rim,5b03903306f776d2ff27ae60,5b03903306f776d2ff27ae60,2018-11-09T10:17:19Z,2018-10-23T10:28:01Z,FALSE,TRUE,NA,food,"mự rim, mu rim",0
5bcef7b1711c5e0013902c8a,goi_kho_bo,5b03903306f776d2ff27ae60,5b03903306f776d2ff27ae60,2018-11-09T10:17:19Z,2018-10-23T10:28:01Z,FALSE,TRUE,NA,food,"gỏi khô bò, goi kho bo, gỏi bò khô, goi bo kho",0
5bcef7b1bc7659001341adce,chao_quay,5b03903306f776d2ff27ae60,5a502b7306f776d2ffa2fea6,2019-03-13T02:58:03Z,2018-10-23T10:28:01Z,FALSE,TRUE,TRUE,food,"háo quẩy, hao quay, háo quẩy sườn, hao quay suon, háo sụn sườn quẩy, hao sun suon quay, hao quay suon sun, háo quẩy sườn sụn",1
5bcef7b113d25d0013eacdd0,sua_chua,5b03903306f776d2ff27ae60,5b03903306f776d2ff27ae60,2018-11-09T10:17:19Z,2018-10-23T10:28:01Z,FALSE,TRUE,NA,food,"sữa hua, sua hua, yogurt, ya-ua, da ua, za ua",0
5bcef7b0bc7659001341adcd,nem_chua_ran,5b03903306f776d2ff27ae60,5b03903306f776d2ff27ae60,2018-11-09T10:17:18Z,2018-10-23T10:28:00Z,FALSE,TRUE,NA,food,"nem hua rán, nem hua ran",0
5bcef7b0bc7659001341adcc,street_food,5b03903306f776d2ff27ae60,5b03903306f776d2ff27ae60,2018-11-09T10:17:18Z,2018-10-23T10:28:00Z,FALSE,TRUE,NA,food,"street food, vỉa hè, via he, đường phố, duong pho",0
5bcef7b0bc7659001341adcb,tra_thao_moc,5b03903306f776d2ff27ae60,5a502b7306f776d2ffa2fea6,2019-03-02T03:14:41Z,2018-10-23T10:28:00Z,FALSE,TRUE,TRUE,food,"trà thảo mộ, tra thao mo, herb tea",1
5bcef7b013d25d0013eacdcf,giai_khat,5b03903306f776d2ff27ae60,5a502b7306f776d2ffa2fea6,2019-03-02T03:15:30Z,2018-10-23T10:28:00Z,FALSE,TRUE,TRUE,food,"giải khát, giai khat, nướ giải khát, nuo giai khat, beverage",1
5bcef7b0711c5e0013902c89,mon_phap,5b03903306f776d2ff27ae60,5a502b7306f776d2ffa2fea6,2019-03-15T02:25:47Z,2018-10-23T10:28:00Z,FALSE,TRUE,TRUE,food,"món pháp, mon phap, đồ ăn pháp, do an phap, thứ ăn pháp, thu an phap, đồ pháp, do phap, frane uisine, frane foods, món Pháp, mon Phap",2
5bcef7b013d25d0013eacdce,tra_bi_dao,5b03903306f776d2ff27ae60,5a502b7306f776d2ffa2fea6,2019-03-02T03:14:10Z,2018-10-23T10:28:00Z,FALSE,TRUE,TRUE,food,"trà bí đao, tra bi dao, winter melon tea",1
5bcef7b0bc7659001341adca,de_thuong,5b03903306f776d2ff27ae60,5b03903306f776d2ff27ae60,2018-11-09T10:17:18Z,2018-10-23T10:28:00Z,FALSE,TRUE,NA,tag,"dễ thương, de thuong, xinh xắn, xinh xan, teen, xi tin, xì tin",0
5bcef7b0711c5e0013902c88,pho,5b03903306f776d2ff27ae60,5b03903306f776d2ff27ae60,2018-11-09T10:17:18Z,2018-10-23T10:28:00Z,FALSE,TRUE,NA,food,"phở, pho",0
5bcef7b013d25d0013eacdcd,cafe_hem,5b03903306f776d2ff27ae60,5a502b7306f776d2ffa2fea6,2019-03-02T03:13:10Z,2018-10-23T10:28:00Z,FALSE,TRUE,TRUE,food,"afe hẻm, afe hem, à phê hẻm, a phe hem, f hẻm, f hem, street offee",1
5bcef7b013d25d0013eacdcc,pho_bo,5b03903306f776d2ff27ae60,5b03903306f776d2ff27ae60,2018-11-09T10:17:18Z,2018-10-23T10:28:00Z,FALSE,TRUE,NA,food,"phở tái, pho tai, phở bò, pho bo, phở tái nạm, pho tai nam, pho nam, phở nạm",0
5bcef7b013d25d0013eacdcb,mi_xao_gion,5b03903306f776d2ff27ae60,5b03903306f776d2ff27ae60,2018-11-09T10:17:18Z,2018-10-23T10:28:00Z,FALSE,TRUE,NA,food,"mì xào giòn, mi xao gion, mỳ xào giòn, my xao gion",0
5bcef7b0711c5e0013902c87,com_chien,5b03903306f776d2ff27ae60,5b03903306f776d2ff27ae60,2018-11-09T10:17:18Z,2018-10-23T10:28:00Z,FALSE,TRUE,NA,food,"om hien, ơm hiên, ơm hiên trứng, om hien trung, ơm hiên bò, om hien bo, ơm hiên á mặn, om hien a man, ơm hiên hải sản, om hien hai san",1
5bcef7b0711c5e0013902c86,xuc_xich,5b03903306f776d2ff27ae60,5a502b7306f776d2ffa2fea6,2019-03-02T03:12:41Z,2018-10-23T10:28:00Z,FALSE,TRUE,TRUE,food,"xú xíh, xu xih, xu xit, sausage",1
5bcef7b05e52b70013373c9f,pho_mai_que,5b03903306f776d2ff27ae60,5a502b7306f776d2ffa2fea6,2019-03-02T03:12:14Z,2018-10-23T10:28:00Z,FALSE,TRUE,TRUE,food,"phô mai que, pho mai que, fo mai que, heese stik",1
5bcef7b05e52b70013373c9e,ca_vien_chien,5b03903306f776d2ff27ae60,5a502b7306f776d2ffa2fea6,2019-03-02T03:11:25Z,2018-10-23T10:28:00Z,FALSE,TRUE,TRUE,food,"á viên hiên, a vien hien, fish ball",1
5bcef7b0711c5e0013902c85,karaoke,5b03903306f776d2ff27ae60,5b03903306f776d2ff27ae60,2018-11-09T10:17:18Z,2018-10-23T10:28:00Z,FALSE,TRUE,NA,food,"karaoke, kara, quan kara, quan karaoke, quán kara",0
5bcef7b0bc7659001341adc9,thanh_cua,5b03903306f776d2ff27ae60,5a502b7306f776d2ffa2fea6,2019-03-12T07:52:40Z,2018-10-23T10:28:00Z,FALSE,TRUE,TRUE,food,"thanh ua, surimi, thanh ua hiên, thanh ua hien",2
5bcef7b0bc7659001341adc8,ga_sot_mam,5b03903306f776d2ff27ae60,5b03903306f776d2ff27ae60,2018-11-09T10:17:18Z,2018-10-23T10:28:00Z,FALSE,TRUE,NA,food,"gà sốt mắm, ga sot mam",0
5bcef7b013d25d0013eacdca,bit_tet,5b03903306f776d2ff27ae60,5a502b7306f776d2ffa2fea6,2019-03-02T03:08:45Z,2018-10-23T10:28:00Z,FALSE,TRUE,TRUE,food,"bít tết, bit tet, bò bít tết, bo bit tet, beefsteak, beef steak, steak",1
5bcef7b05e52b70013373c9d,canh_rong_bien,5b03903306f776d2ff27ae60,5a502b7306f776d2ffa2fea6,2019-03-02T03:11:01Z,2018-10-23T10:28:00Z,FALSE,TRUE,TRUE,food,"anh rong biển, anh rong biển, anh rong biển hq, anh rong biển hq, anh rong biến hàn quố, anh rong bien han quo, seaweed soup",1
5bcd543f1686500013fa8bc2,su_kem,5b03903306f776d2ff27ae60,5a502b7306f776d2ffa2fea6,2019-03-02T03:08:22Z,2018-10-22T04:38:23Z,FALSE,TRUE,TRUE,food,"su kem, bánh su kem, banh su kem, ream puff",1
5bcd389cc94b9b234c647bff,thit_nuong,5b03903306f776d2ff27ae60,5a502b7306f776d2ffa2fea6,2019-03-02T03:07:57Z,2018-10-22T02:40:28Z,FALSE,TRUE,TRUE,food,"thịt nướng, thit nuong, ba hi nuong, ba hỉ nướng, bò nướng, bo nuong, thịt xiên nướng, thit xien nuong, bbq, barbeue",2
5bcd389cc94b9b234c647bfe,ram_bap,5b03903306f776d2ff27ae60,5b03903306f776d2ff27ae60,2018-11-09T10:17:18Z,2018-10-22T02:40:28Z,FALSE,TRUE,NA,food,"ram bap, ram bắp",0
5bcd389cc94b9b234c647bfd,hoanh_thanh,5b03903306f776d2ff27ae60,5a502b7306f776d2ffa2fea6,2019-03-02T03:07:27Z,2018-10-22T02:40:28Z,FALSE,TRUE,TRUE,food,"hoành thánh, hoanh thanh, wonton",1
5bcd389cc94b9b234c647bfc,cuoi_tuan,5b03903306f776d2ff27ae60,5a502b7306f776d2ffa2fea6,2019-03-02T03:06:54Z,2018-10-22T02:40:28Z,FALSE,TRUE,TRUE,tag,"uối tuần, uoi tuan, thư giãn, thu gian, hủ nhật, hu nhat, thứ 7, thu 7, thứ bảy, thu bay, thứ bẩy, weekend",2
5bcd389cc94b9b234c647bfb,cang_ghe,5b03903306f776d2ff27ae60,5b03903306f776d2ff27ae60,2018-10-22T02:40:28Z,2018-10-22T02:40:28Z,FALSE,TRUE,TRUE,food,"àng ghẹ, ang ghe, àng ghẹ rang muối, ang ghe rang muoi",0
