X_id,key,createdBy,updatedBy,updatedAt,createdAt,isDeleted,isTrained,isActive,type,synonyms,__v
5c04b6fb08baad0015dc63ff,com_hen,5a502b7306f776d2ffa2fea6,5a502b7306f776d2ffa2fea6,2019-03-02T03:58:37Z,2018-12-03T04:54:19Z,FALSE,TRUE,TRUE,food,"ơm hến, om hen, ơm hến huế, om hen hue, lam rie",1
5c01ea503d317000152d2b3b,chocolate,5a502b7306f776d2ffa2fea6,5a502b7306f776d2ffa2fea6,2018-12-01T01:56:32Z,2018-12-01T01:56:32Z,FALSE,TRUE,TRUE,food,"hoolate, sô ô la, soola, hô ô la, hoola, ho-o-la",0
5bffc1d66dbb2f0015123d2b,don,5a502b7306f776d2ffa2fea6,5a502b7306f776d2ffa2fea6,2018-11-29T10:39:18Z,2018-11-29T10:39:18Z,FALSE,TRUE,TRUE,food,"don, don quảng ngãi, don quang ngai, món don, mon don, gion",0
5bffafc46dbb2f0015123b9d,bun_oc,5a502b7306f776d2ffa2fea6,5a502b7306f776d2ffa2fea6,2018-11-29T09:22:12Z,2018-11-29T09:22:12Z,FALSE,TRUE,TRUE,food,"bún ố, bun o, bún ố hà nội, bun o ha noi",0
5bff5380124b8600150d0ccc,canh_kim_chi,5a502b7306f776d2ffa2fea6,5a502b7306f776d2ffa2fea6,2019-03-02T03:58:13Z,2018-11-29T02:48:32Z,FALSE,TRUE,TRUE,food,"anh kim hi, kimhi soup",1
5bfcfc110a1bdf00157d7efc,bun,5a502b7306f776d2ffa2fea6,5a502b7306f776d2ffa2fea6,2018-11-27T08:13:11Z,2018-11-27T08:10:57Z,FALSE,TRUE,TRUE,food,"bun, bún, món bún, mon bun",1
5bf906839e261e001570e019,chao_hau,5b03903306f776d2ff27ae60,5a502b7306f776d2ffa2fea6,2019-03-02T03:57:23Z,2018-11-24T08:06:27Z,FALSE,TRUE,TRUE,food,"háo hàu, hao hau, oyster ongee",1
5bf906832137880015ec49d0,che_ha_noi,5b03903306f776d2ff27ae60,5b03903306f776d2ff27ae60,2018-11-24T08:06:27Z,2018-11-24T08:06:27Z,FALSE,TRUE,TRUE,food,"hè hà nội, he ha noi, hè Hà Nội, he Ha Noi, hè HN, he HN",0
5bf906839e261e001570e018,bun_bung,5b03903306f776d2ff27ae60,5b03903306f776d2ff27ae60,2018-11-24T08:06:27Z,2018-11-24T08:06:27Z,FALSE,TRUE,TRUE,food,"bún bung, bun bung",0
5bf906832137880015ec49cf,lau_1_nguoi,5b03903306f776d2ff27ae60,5b03903306f776d2ff27ae60,2018-11-24T08:06:27Z,2018-11-24T08:06:27Z,FALSE,TRUE,TRUE,food,"lẩu 1 người, lau 1 nguoi, lẩu một người, lau mot nguoi",0
5bf906839e261e001570e017,nem_nuong,5b03903306f776d2ff27ae60,5b03903306f776d2ff27ae60,2018-11-24T08:06:27Z,2018-11-24T08:06:27Z,FALSE,TRUE,TRUE,food,"nem nướng, nem nuong, nem nướng nha trang, nem nuong nha trang",0
5bf906839e261e001570e016,bun_ca_ro,5b03903306f776d2ff27ae60,5b03903306f776d2ff27ae60,2018-11-24T08:06:27Z,2018-11-24T08:06:27Z,FALSE,TRUE,TRUE,food,"bún á rô, bun a ro",0
5bf906839e261e001570e015,banh_da_cua,5b03903306f776d2ff27ae60,5b03903306f776d2ff27ae60,2018-11-24T08:06:27Z,2018-11-24T08:06:27Z,FALSE,TRUE,TRUE,food,"bánh đa ua, banh da ua",0
5bf6bbd74e55970015b27aa7,cheese_tart,5b03903306f776d2ff27ae60,5b03903306f776d2ff27ae60,2018-11-22T14:23:19Z,2018-11-22T14:23:19Z,FALSE,TRUE,TRUE,food,heese tart,0
5bf6bbd642714d0015c0a3f5,lau_bo,5b03903306f776d2ff27ae60,5a502b7306f776d2ffa2fea6,2019-03-02T03:56:33Z,2018-11-22T14:23:18Z,FALSE,TRUE,TRUE,food,"lẩu bò, lau bo, beef hot pot, beef hotpot",1
5bf6bbd642714d0015c0a3f4,ba_chi_nuong,5b03903306f776d2ff27ae60,5a502b7306f776d2ffa2fea6,2019-03-02T03:56:58Z,2018-11-22T14:23:18Z,FALSE,TRUE,TRUE,food,"ba hỉ nướng, ba hi nuong, thịt ba hỉ nướng, thit ba hi nuong, grill pork, grilled pork",1
5bf6bbd642714d0015c0a3f3,mi_chachang,5b03903306f776d2ff27ae60,5b03903306f776d2ff27ae60,2018-11-22T14:23:18Z,2018-11-22T14:23:18Z,FALSE,TRUE,TRUE,food,"mì hahang, mi hahang, mỳ hahang, my hahang, mì hahang hàn quố, mi hahang han quo, mỳ hahang hàn quố, my hahang han quo, mì hàn quố, mi han quo, mỳ hàn quố, my han quo, mì hahan, mi hahan, mỳ hahan, my hahan",0
5bf6bbd642714d0015c0a3f2,bo_ne,5b03903306f776d2ff27ae60,5a502b7306f776d2ffa2fea6,2018-12-11T01:53:01Z,2018-11-22T14:23:18Z,FALSE,TRUE,TRUE,food,"bò né, bo ne, thịt bò né, thit bo ne",1
5befa32af115c3001372f66b,giang_sinh,5b03903306f776d2ff27ae60,5a502b7306f776d2ffa2fea6,2019-03-02T03:56:02Z,2018-11-17T05:12:10Z,FALSE,TRUE,TRUE,tag,"giáng sinh, giang sinh, noel, lễ giáng sinh, le giang sinh, hristmas, xmas",1
5befa32af115c3001372f66a,tet_ta,5b03903306f776d2ff27ae60,5a502b7306f776d2ffa2fea6,2019-03-02T03:55:42Z,2018-11-17T05:12:10Z,FALSE,TRUE,TRUE,tag,"tết ta, tet ta, tết âm lịh, tet am lih, năm mới, nam moi, tết âm, tet am, tết nguyên đán, tet nguyen dan, lunar new year, hinese new year",3
5befa32ad5743a00130e416d,tet_tay,5b03903306f776d2ff27ae60,5a502b7306f776d2ffa2fea6,2019-03-02T03:54:49Z,2018-11-17T05:12:10Z,FALSE,TRUE,TRUE,tag,"tết tây, tet tay, 1/1, 1-1, tết dương lịh, tet duong lih, 1 1, new year",1
5befa32ad5743a00130e416c,kem_tu_chon,5b03903306f776d2ff27ae60,5b03903306f776d2ff27ae60,2018-11-17T05:12:10Z,2018-11-17T05:12:10Z,FALSE,TRUE,TRUE,food,"kem tự họn, kem tu hon",0
5befa32a247e4900131731c3,20_11,5b03903306f776d2ff27ae60,5b03903306f776d2ff27ae60,2018-11-17T05:12:10Z,2018-11-17T05:12:10Z,FALSE,TRUE,TRUE,tag,"20/11, 20-11, tết thầy ô, tet thay o, ngay nha giao viet nam, ngày nhà giáo việt nam, ngày nhà giáo VN, ngay nha giao VN, ngày thầy ô, ngay thay o, thầy ô, thay o, 20 11",0
5befa32a2b44c50013464d86,kem_y,5b03903306f776d2ff27ae60,5a502b7306f776d2ffa2fea6,2019-03-02T03:54:16Z,2018-11-17T05:12:10Z,FALSE,TRUE,TRUE,food,"kem ý, kem y, italian ie ream",1
5befa32a247e4900131731c2,mon_bac,5b03903306f776d2ff27ae60,5a502b7306f776d2ffa2fea6,2018-11-27T08:10:31Z,2018-11-17T05:12:10Z,FALSE,TRUE,TRUE,food,"món bắ, mon ba, đồ ăn bắ, do an ba, thu an ba, thứ ăn bắ, quán bắ, quan ba, bắ",1
5befa32af115c3001372f669,chao,5b03903306f776d2ff27ae60,5a502b7306f776d2ffa2fea6,2019-03-02T03:53:51Z,2018-11-17T05:12:10Z,FALSE,TRUE,TRUE,food,"háo, hao, ongee",1
5befa32af115c3001372f668,hu_tieu_nam_vang,5b03903306f776d2ff27ae60,5b03903306f776d2ff27ae60,2018-11-17T05:12:10Z,2018-11-17T05:12:10Z,FALSE,TRUE,TRUE,food,"hủ tiếu nam vang, hu tieu nam vang, hũ tiếu nam vang, hủ tíu nam vang, hu tiu nam vang, hũ tíu nam vang",0
5befa32af115c3001372f667,kem_flan,5b03903306f776d2ff27ae60,5b03903306f776d2ff27ae60,2018-11-17T05:12:10Z,2018-11-17T05:12:10Z,FALSE,TRUE,TRUE,food,"kem flan, kem plan, plang, plăng, flang",0
5befa32a2b44c50013464d85,bo_duong,5b03903306f776d2ff27ae60,5b03903306f776d2ff27ae60,2018-12-22T04:54:32Z,2018-11-17T05:12:10Z,FALSE,TRUE,TRUE,tag,"bổ dưỡng, bo duong, bổ",1
5bee2b1be75f4e00133ff695,uno,5b03903306f776d2ff27ae60,5b03903306f776d2ff27ae60,2018-11-17T05:10:10Z,2018-11-16T02:27:39Z,FALSE,TRUE,NA,tag,"uno, bài uno, bai uon, hơi uno, hoi uno, đánh bài uno, danh bai uno",1
5bee2b1bf64c7000136373fc,board_game,5b03903306f776d2ff27ae60,5b03903306f776d2ff27ae60,2018-11-16T02:27:39Z,2018-11-16T02:27:39Z,FALSE,TRUE,TRUE,tag,board game,0
5bee2b1bf64c7000136373fb,met_heo,5b03903306f776d2ff27ae60,5b03903306f776d2ff27ae60,2018-11-16T02:27:39Z,2018-11-16T02:27:39Z,FALSE,TRUE,TRUE,food,"mẹt heo, met heo",0
5bee2b1be75f4e00133ff694,met_com_lam,5b03903306f776d2ff27ae60,5b03903306f776d2ff27ae60,2018-11-16T02:27:39Z,2018-11-16T02:27:39Z,FALSE,TRUE,TRUE,food,"mẹt ơm lam, met om lam",0
5bee2b1a0f06a10013fd778a,acoustic,5b03903306f776d2ff27ae60,5b03903306f776d2ff27ae60,2018-11-16T02:27:38Z,2018-11-16T02:27:38Z,FALSE,TRUE,TRUE,tag,"aousti, nhạ aousti, nha aousti",0
5bee2b1a551b5900131efdc5,met_bo,5b03903306f776d2ff27ae60,5b03903306f776d2ff27ae60,2018-11-16T02:27:38Z,2018-11-16T02:27:38Z,FALSE,TRUE,TRUE,food,"mẹt bò, met bo",0
5bee2b1a551b5900131efdc4,hotdog,5b03903306f776d2ff27ae60,5b03903306f776d2ff27ae60,2018-11-16T02:27:38Z,2018-11-16T02:27:38Z,FALSE,TRUE,TRUE,food,"hotdog, hot dog, bánh mì kẹp xú xíh, banh mi kep xu xih, bánh mỳ kep xu xih, banh my kep xu xih",0
5bee2b1af64c7000136373fa,nha_hang,5b03903306f776d2ff27ae60,5b03903306f776d2ff27ae60,2018-11-16T02:27:38Z,2018-11-16T02:27:38Z,FALSE,TRUE,TRUE,food,"nhà hàng, nha hang, restaurant",0
5bee2b1af64c7000136373f9,banh_trang_nuong,5b03903306f776d2ff27ae60,5b03903306f776d2ff27ae60,2018-11-16T02:27:38Z,2018-11-16T02:27:38Z,FALSE,TRUE,TRUE,food,"bánh tráng nướng, banh trang nuong, bánh tráng tương, banh trang tuong, bánh tráng tương khô, banh trang tuong kho",0
5bee2b1a0f06a10013fd7789,trung_cut_nuong,5b03903306f776d2ff27ae60,5b03903306f776d2ff27ae60,2018-11-27T08:07:41Z,2018-11-16T02:27:38Z,FALSE,TRUE,TRUE,food,"trứng út nướng, trung ut nuong, trứng út hén nướng, trung ut hen nuong, trứng út hén, trung ut hen",1
5bea9237ac4e5800138da893,banh_mi_tom,5b03903306f776d2ff27ae60,5b03903306f776d2ff27ae60,2018-11-16T02:27:38Z,2018-11-13T08:58:31Z,FALSE,TRUE,NA,food,"bánh mì tôm, banh mi tom, bánh mỳ tôm, banh my tom",0
5bea92375185c00013224416,skyview,5b03903306f776d2ff27ae60,5b03903306f776d2ff27ae60,2018-11-16T02:27:38Z,2018-11-13T08:58:31Z,FALSE,TRUE,NA,tag,"skyview, view trên ao, view tren ao, trên ao, tren ao, sky view",1
5bea923763c2ce001375618f,banh_mi_tho_nhi_ky,5b03903306f776d2ff27ae60,5b03903306f776d2ff27ae60,2018-11-16T02:27:38Z,2018-11-13T08:58:31Z,FALSE,TRUE,NA,food,"bánh mì thổ nhĩ kỳ, banh mi tho nhi ky, bánh mỳ thổ nhĩ kỳ, banh my tho nhi ky, banh mi tho nhi ki, bánh mì thổ nhĩ kì, bánh mỳ thổ nhĩ kì, banh my tho nhi ky, bánh mì tnk, banh mi tnk, bánh mỳ tnk, banh my tnk, kebap, kebab",0
5be949dfa09c0b00136b2aed,banh_duc,5b03903306f776d2ff27ae60,5b03903306f776d2ff27ae60,2018-11-12T09:37:35Z,2018-11-12T09:37:35Z,FALSE,TRUE,TRUE,food,"bánh đú, banh du",0
5be949dfa09c0b00136b2aec,com,5b03903306f776d2ff27ae60,5b03903306f776d2ff27ae60,2018-11-13T08:58:31Z,2018-11-12T09:37:35Z,FALSE,TRUE,NA,food,"ơm, om, ơm bình dân, ơm bụi, ơm trưa, ơm giá rẻ, om binh dan, om bui, om trua, om gia re",0
5be8f1776c5dcc0013d3bc46,bun_long,5b03903306f776d2ff27ae60,5b03903306f776d2ff27ae60,2018-11-12T03:20:23Z,2018-11-12T03:20:23Z,FALSE,TRUE,TRUE,food,"bún lòng, bun long, bún lòng nướ, bun long nuo",0
5be8f17766b0950013c9be44,bun_ngan,5b03903306f776d2ff27ae60,5b03903306f776d2ff27ae60,2018-11-12T03:20:23Z,2018-11-12T03:20:23Z,FALSE,TRUE,TRUE,food,"bún ngan, bun ngan, bún ngang, bun ngang",0
5be55eb60065360013edb28b,banh_obanyaki,5b03903306f776d2ff27ae60,5b03903306f776d2ff27ae60,2018-11-09T10:17:26Z,2018-11-09T10:17:26Z,FALSE,TRUE,TRUE,food,"bánh obanyaki, banh obanyaki, obanyaki",0
5be55eb6a8b3b40013859acc,cut_lon_xao_me,5b03903306f776d2ff27ae60,5b03903306f776d2ff27ae60,2018-11-09T10:17:26Z,2018-11-09T10:17:26Z,FALSE,TRUE,TRUE,food,"út lộn xào me, ut lon xao me, trứng út xào me, trung ut xao me",0
5be55eb6a8b3b40013859acb,xoi_tieu,5b03903306f776d2ff27ae60,5a502b7306f776d2ffa2fea6,2019-05-10T07:47:13Z,2018-11-09T10:17:26Z,FALSE,FALSE,TRUE,food,"xôi tiêu, xoi tieu, bánh xôi tiêu, banh xoi tieu",1
5be55eb6b0dcbd0013124361,banh_nuong_to_ong,5b03903306f776d2ff27ae60,5b03903306f776d2ff27ae60,2018-11-09T10:17:26Z,2018-11-09T10:17:26Z,FALSE,TRUE,TRUE,food,"bánh nướng tổ ong, banh nuong to ong, bánh tổ ong, banh to ong",0
5be55eb6c711d600136780b0,suon_nuong,5b03903306f776d2ff27ae60,5a502b7306f776d2ffa2fea6,2019-03-02T03:51:26Z,2018-11-09T10:17:26Z,FALSE,TRUE,TRUE,food,"sườn nướng, suon nuong, grill rib, grilled rib",1
5be55eb60065360013edb28a,bingsu,5b03903306f776d2ff27ae60,5b03903306f776d2ff27ae60,2018-11-09T10:17:26Z,2018-11-09T10:17:26Z,FALSE,TRUE,TRUE,food,bingsu,0
5be55eb6b0dcbd0013124360,gan_rim,5b03903306f776d2ff27ae60,5b03903306f776d2ff27ae60,2018-11-09T10:17:26Z,2018-11-09T10:17:26Z,FALSE,TRUE,TRUE,food,gan rim,0
5be55eb60065360013edb289,bo_kho,5b03903306f776d2ff27ae60,5b03903306f776d2ff27ae60,2018-11-09T10:17:26Z,2018-11-09T10:17:26Z,FALSE,TRUE,TRUE,food,"bò khô, bo kho, khô bò, kho bo",0
5be55eb6c711d600136780af,bo_nhung_ot,5b03903306f776d2ff27ae60,5a502b7306f776d2ffa2fea6,2018-12-26T02:57:59Z,2018-11-09T10:17:26Z,FALSE,TRUE,TRUE,food,"bò nhúng ớt, bo nhung ot, bò nhúng, bo nhung",1
5be55eb6b0dcbd001312435f,banh_loc_mang,5b03903306f776d2ff27ae60,5a502b7306f776d2ffa2fea6,2018-11-28T03:13:18Z,2018-11-09T10:17:26Z,FALSE,TRUE,TRUE,food,"bánh lọ măng, banh lo mang, bánh bột lọ măng, banh bot lo mang, bánh bột lọ nhân măng, banh bot lo nhan mang, bột lọ măng, bot lo mang",1
5be55eb6c711d600136780ae,goi_tom_cuon,5b03903306f776d2ff27ae60,5b03903306f776d2ff27ae60,2018-11-09T10:17:26Z,2018-11-09T10:17:26Z,FALSE,TRUE,TRUE,food,"gỏi uốn tôm, goi uon tom, gỏi tôm uốn, goi tom uon",0
5bd90267d82910001302c76a,hu_tieu_mi,5b03903306f776d2ff27ae60,5b03903306f776d2ff27ae60,2018-11-09T10:17:26Z,2018-10-31T01:16:23Z,FALSE,TRUE,NA,food,"hủ tiếu mì, hu tieu mi, hủ tiếu mỳ, hu tieu my, hủ tíu mì, hu tiu mi, hủ tíu mỳ, hu tiu my",0
5bd90267d82910001302c769,banh_mi_hai_san,5b03903306f776d2ff27ae60,5b03903306f776d2ff27ae60,2018-11-09T10:17:26Z,2018-10-31T01:16:23Z,FALSE,TRUE,NA,food,"bánh mì hải sản, banh mi hai san, bánh mỳ hải sản, banh my hai san",0
5bd90267d82910001302c768,nui_xeo,5b03903306f776d2ff27ae60,5b03903306f776d2ff27ae60,2018-11-09T10:17:26Z,2018-10-31T01:16:23Z,FALSE,TRUE,NA,food,"nuôi xèo, nuoi xeo, nui xèo, nui xeo",0
5bd90267d82910001302c767,mi_xeo,5b03903306f776d2ff27ae60,5b03903306f776d2ff27ae60,2018-11-09T10:17:25Z,2018-10-31T01:16:23Z,FALSE,TRUE,NA,food,"mi xeo, mì xèo, my xeo, mỳ xèo",0
5bd902673ea2f50013ac26be,lau_de,5b03903306f776d2ff27ae60,5a502b7306f776d2ffa2fea6,2019-03-02T03:50:24Z,2018-10-31T01:16:23Z,FALSE,TRUE,TRUE,food,"lẩu dê, lau de, goat hot pot",1
5bd90267d82910001302c766,nem_cua,5b03903306f776d2ff27ae60,5a502b7306f776d2ffa2fea6,2019-03-02T03:50:52Z,2018-10-31T01:16:23Z,FALSE,TRUE,TRUE,food,"nem ua, nem ua bể, nem ua be, rab spring roll",1
5bd90267d82910001302c765,an_nhe,5b03903306f776d2ff27ae60,5a502b7306f776d2ffa2fea6,2019-05-09T09:10:15Z,2018-10-31T01:16:23Z,FALSE,FALSE,TRUE,food,"ăn nhẹ, an nhe, snak",1
5bd902673ea2f50013ac26bd,thit_de,5b03903306f776d2ff27ae60,5a502b7306f776d2ffa2fea6,2019-03-02T03:50:05Z,2018-10-31T01:16:23Z,FALSE,TRUE,TRUE,food,"thịt dê, thit de, goat meat",1
5bd90266d82910001302c764,sandwich,5b03903306f776d2ff27ae60,5b03903306f776d2ff27ae60,2018-11-09T10:17:25Z,2018-10-31T01:16:22Z,FALSE,TRUE,NA,food,sandwih,0
5bd902663ea2f50013ac26bc,tra_lai,5b03903306f776d2ff27ae60,5a502b7306f776d2ffa2fea6,2019-03-02T03:49:40Z,2018-10-31T01:16:22Z,FALSE,TRUE,TRUE,food,"trà lài, tra lai, trà hoa lài, tra hoa lai, jasmine tea",1
5bd90266c43b9600139cc9ad,cut_lon,5b03903306f776d2ff27ae60,5a502b7306f776d2ffa2fea6,2019-03-02T03:49:07Z,2018-10-31T01:16:22Z,FALSE,TRUE,TRUE,food,"út lộn, ut lon, trứng út lộn, trung ut lon, quail balut",1
5bd9026688e9a60013a25bab,lau_miso,5b03903306f776d2ff27ae60,5a502b7306f776d2ffa2fea6,2019-03-02T03:42:18Z,2018-10-31T01:16:22Z,FALSE,TRUE,TRUE,food,"lẩu miso, lau miso, miso hot pot",1
5bd90266d82910001302c763,dui_cuu_nuong,5b03903306f776d2ff27ae60,5a502b7306f776d2ffa2fea6,2019-03-02T03:42:49Z,2018-10-31T01:16:22Z,FALSE,TRUE,TRUE,food,"đùi ừu nướng, dui uu nuong, ừu nướng, uu nuong, grill gigot, grilled gigot",1
5bd902663ea2f50013ac26bb,thit_cuu,5b03903306f776d2ff27ae60,5a502b7306f776d2ffa2fea6,2019-03-02T03:47:33Z,2018-10-31T01:16:22Z,FALSE,TRUE,TRUE,food,"thịt ừu, thit uu, ừu, uu, lamb, hogget, mutton",2
5bd902663ea2f50013ac26ba,ca_hoi,5b03903306f776d2ff27ae60,5a502b7306f776d2ffa2fea6,2019-03-02T03:40:54Z,2018-10-31T01:16:22Z,FALSE,TRUE,TRUE,food,"á hồi, a hoi, salmon",1
5bd902663ea2f50013ac26b9,an_toi,5b03903306f776d2ff27ae60,5a25cd17f36d280fefe391ac,2019-05-02T12:23:31Z,2018-10-31T01:16:22Z,FALSE,FALSE,TRUE,food,"ăn tối, an toi, dinner, tối",2
5bd90266d82910001302c762,buffet,5b03903306f776d2ff27ae60,5a502b7306f776d2ffa2fea6,2019-03-01T09:12:11Z,2018-10-31T01:16:22Z,FALSE,TRUE,TRUE,food,"buffet, but phe, bup phe, buffer, búp phê, buffet hotpot",1
5bd9026688e9a60013a25baa,burger,5b03903306f776d2ff27ae60,5a502b7306f776d2ffa2fea6,2018-12-17T02:38:35Z,2018-10-31T01:16:22Z,FALSE,TRUE,TRUE,food,"burger, hamburger, hambeger, hăm bơ gơ, hambogo",2
5bd902663ea2f50013ac26b8,ga_ran,5b03903306f776d2ff27ae60,5a502b7306f776d2ffa2fea6,2019-03-02T03:40:15Z,2018-10-31T01:16:22Z,FALSE,TRUE,TRUE,food,"gà rán, ga ran, hiken, fry hiken",2
5bd9026688e9a60013a25ba9,banh_man,5b03903306f776d2ff27ae60,5b03903306f776d2ff27ae60,2018-11-09T10:17:25Z,2018-10-31T01:16:22Z,FALSE,TRUE,NA,food,"bánh mặn, banh man, bánh nhân mặn, banh nhan man",0
5bd90266d82910001302c761,taiyaki,5b03903306f776d2ff27ae60,5b03903306f776d2ff27ae60,2018-11-09T10:17:25Z,2018-10-31T01:16:22Z,FALSE,TRUE,NA,food,taiyaki,0
5bd90266d82910001302c760,phong_tra,5b03903306f776d2ff27ae60,5b03903306f776d2ff27ae60,2018-11-09T10:17:25Z,2018-10-31T01:16:22Z,FALSE,TRUE,NA,tag,"phòng trà, phong tra, nhạ nhẹ, nha nhe, hat ho nhau nghe, hát ho nhau nghe",0
5bd90266c43b9600139cc9ac,banh_mi_que,5b03903306f776d2ff27ae60,5a502b7306f776d2ffa2fea6,2019-02-25T07:05:20Z,2018-10-31T01:16:22Z,FALSE,TRUE,TRUE,food,"bánh mì que, banh mi que, bánh mỳ que, banh my que",1
5bd9026688e9a60013a25ba8,trai_cay_tu_chon,5b03903306f776d2ff27ae60,5a502b7306f776d2ffa2fea6,2019-03-02T03:39:47Z,2018-10-31T01:16:22Z,FALSE,TRUE,TRUE,food,"trái ây tự họn, trai ay tu hon, fruit",1
5bd902663ea2f50013ac26b7,com_tho,5b03903306f776d2ff27ae60,5b03903306f776d2ff27ae60,2018-11-09T10:17:25Z,2018-10-31T01:16:22Z,FALSE,TRUE,NA,food,"ơm thố, om tho",0
5bd90265c43b9600139cc9ab,oc,5b03903306f776d2ff27ae60,5a502b7306f776d2ffa2fea6,2019-03-02T03:39:17Z,2018-10-31T01:16:21Z,FALSE,TRUE,TRUE,food,"ố, o, ố á loại, o a loai, sea snail",1
5bd902653ea2f50013ac26b6,com_van_phong,5b03903306f776d2ff27ae60,5b03903306f776d2ff27ae60,2018-11-09T10:17:25Z,2018-10-31T01:16:21Z,FALSE,TRUE,NA,food,"ơm văn phòng, om van phong",0
5bd90265c43b9600139cc9aa,tra_trai_cay,5b03903306f776d2ff27ae60,5a502b7306f776d2ffa2fea6,2019-03-02T03:38:45Z,2018-10-31T01:16:21Z,FALSE,TRUE,TRUE,food,"trà trái ây, tra trai ay, fruit tea",1
5bd3c55f87f9dc00130df838,kem_dua,5b03903306f776d2ff27ae60,5a502b7306f776d2ffa2fea6,2019-03-02T03:37:29Z,2018-10-27T01:54:39Z,FALSE,TRUE,TRUE,food,"kem dừa, kem dua, oonut ie ream",1
5bd3c55f87f9dc00130df837,tra_nhat_ban,5b03903306f776d2ff27ae60,5a502b7306f776d2ffa2fea6,2019-03-02T03:38:19Z,2018-10-27T01:54:39Z,FALSE,TRUE,TRUE,food,"trà nhật bản, tra nhat ban, japanese tea",1
5bd3c55f40965d0013d4d201,tra_xanh,5b03903306f776d2ff27ae60,5b03903306f776d2ff27ae60,2018-11-09T10:17:24Z,2018-10-27T01:54:39Z,FALSE,TRUE,NA,food,"trà xanh, tra xanh",0
5bd3c55f87f9dc00130df836,tiec_cong_ty,5b03903306f776d2ff27ae60,5a502b7306f776d2ffa2fea6,2018-12-05T09:20:44Z,2018-10-27T01:54:39Z,FALSE,TRUE,TRUE,tag,"tiệ ông ty, tie ong ty, ông ty, ong ty",1
5bd3c55f0a83d9001336c5ab,lien_hoan,5b03903306f776d2ff27ae60,5b03903306f776d2ff27ae60,2018-11-09T10:17:24Z,2018-10-27T01:54:39Z,FALSE,TRUE,NA,tag,"liên hoan, lien hoan",0
5bd3c55f0a83d9001336c5aa,chao_ngheu,5b03903306f776d2ff27ae60,5a502b7306f776d2ffa2fea6,2019-03-02T03:36:58Z,2018-10-27T01:54:39Z,FALSE,TRUE,TRUE,food,"háo nghêu, hao ngheu, lam ongee",1
5bd3c55f87f9dc00130df835,banh_mi_da_dieu,5b03903306f776d2ff27ae60,5b03903306f776d2ff27ae60,2018-11-09T10:17:24Z,2018-10-27T01:54:39Z,FALSE,TRUE,NA,food,"bánh mì đà điểu, banh mi da dieu, bánh mỳ đà điểu, banh my da dieu",0
5bd3c55f40965d0013d4d200,chao_dua,5b03903306f776d2ff27ae60,5b03903306f776d2ff27ae60,2018-11-09T10:17:24Z,2018-10-27T01:54:39Z,FALSE,TRUE,NA,food,"háo dứa, hao dua, háo lá dứa, hao la dua",1
5bd3c55f0a83d9001336c5a9,chao_luon,5b03903306f776d2ff27ae60,5a502b7306f776d2ffa2fea6,2019-03-02T03:36:37Z,2018-10-27T01:54:39Z,FALSE,TRUE,TRUE,food,"háo lươn, hao luon, eel ongee",1
5bd3c55f89c11d0013cf56ef,chao_ech,5b03903306f776d2ff27ae60,5a502b7306f776d2ffa2fea6,2019-03-02T03:36:09Z,2018-10-27T01:54:39Z,FALSE,TRUE,TRUE,food,"háo ếh, hao eh, frog ongee",1
5bd3c55f0a83d9001336c5a8,chao_gao_lut,5b03903306f776d2ff27ae60,5b03903306f776d2ff27ae60,2018-11-09T10:17:24Z,2018-10-27T01:54:39Z,FALSE,TRUE,NA,food,"háo gạo lứt, hao gao lut, hao gao lu, hao gao lu",0
5bd3c55f89c11d0013cf56ee,bun_thang,5b03903306f776d2ff27ae60,5a502b7306f776d2ffa2fea6,2019-02-22T08:22:34Z,2018-10-27T01:54:39Z,FALSE,TRUE,TRUE,food,"bún thang, bun thang, bún than, bun than, bún thang Ha Noi, bun thang Ha Noi",1
5bd3c55f40965d0013d4d1ff,bun_cha,5b03903306f776d2ff27ae60,5b03903306f776d2ff27ae60,2018-11-09T10:17:24Z,2018-10-27T01:54:39Z,FALSE,TRUE,NA,food,"bún hả, bun ha, bún hả hà nội, bun ha ha noi, bun ha hn, bún hả hn",0
5bd3c55f40965d0013d4d1fe,banh_mi_cha_ca,5b03903306f776d2ff27ae60,5b03903306f776d2ff27ae60,2018-11-09T10:17:24Z,2018-10-27T01:54:39Z,FALSE,TRUE,NA,food,"bánh mì hả á, banh mi ha a, bánh mỳ hả á, banh my ha a",0
5bd3c55f89c11d0013cf56ed,chan_ga_nuong,5b03903306f776d2ff27ae60,5a502b7306f776d2ffa2fea6,2019-03-02T03:35:06Z,2018-10-27T01:54:39Z,FALSE,TRUE,TRUE,food,"hân gà nướng, han ga nuong, hân gà, han ga, hân gà nướng muối ớt, han ga nuong muoi ot, grill hiken leg",2
5bd3c55f87f9dc00130df834,canh_ga_nuong,5b03903306f776d2ff27ae60,5a502b7306f776d2ffa2fea6,2019-03-02T03:35:42Z,2018-10-27T01:54:39Z,FALSE,TRUE,TRUE,food,"ánh gà nướng, anh ga nuong, grill hiken wing",1
5bd3c55f89c11d0013cf56ec,tra_quan,5b03903306f776d2ff27ae60,5a502b7306f776d2ffa2fea6,2019-03-02T03:34:39Z,2018-10-27T01:54:39Z,FALSE,TRUE,TRUE,food,"trà quán, tra quan, thưởng trà, thuong tra, trà đạo, tra dao, trà hiều, tra hieu, tea house",2
5bd3c55f87f9dc00130df833,xoi_man,5b03903306f776d2ff27ae60,5b03903306f776d2ff27ae60,2018-11-09T10:17:24Z,2018-10-27T01:54:39Z,FALSE,TRUE,NA,food,"xôi mặn, xoi man",0
5bd3c55f89c11d0013cf56eb,banh_canh_xuong,5b03903306f776d2ff27ae60,5b03903306f776d2ff27ae60,2018-11-09T10:17:24Z,2018-10-27T01:54:39Z,FALSE,TRUE,NA,food,"bánh anh xương, banh anh xuong",0
5bd3c55f87f9dc00130df832,pho_ga,5b03903306f776d2ff27ae60,5b03903306f776d2ff27ae60,2018-11-09T10:17:24Z,2018-10-27T01:54:39Z,FALSE,TRUE,NA,food,"phở gà, pho ga",0
5bd3c55f0a83d9001336c5a7,banh_canh_cua,5b03903306f776d2ff27ae60,5b03903306f776d2ff27ae60,2018-11-09T10:17:24Z,2018-10-27T01:54:39Z,FALSE,TRUE,NA,food,"bánh anh ua, banh anh ua",0
5bd3c55e87f9dc00130df831,mien_ga,5b03903306f776d2ff27ae60,5a502b7306f776d2ffa2fea6,2019-03-02T03:34:10Z,2018-10-27T01:54:38Z,FALSE,TRUE,TRUE,food,"miến gà, mien ga, hiken vermielli",1
5bd3c55e0a83d9001336c5a6,ca_nuc,5b03903306f776d2ff27ae60,5b03903306f776d2ff27ae60,2018-11-09T10:17:23Z,2018-10-27T01:54:38Z,FALSE,TRUE,NA,food,"á nụ, a nu, á nụ nướng, a nu nuong",0
5bd3c55e89c11d0013cf56ea,oc_buou,5b03903306f776d2ff27ae60,5a502b7306f776d2ffa2fea6,2019-02-25T07:24:51Z,2018-10-27T01:54:38Z,FALSE,TRUE,TRUE,food,"ố bươu, o buou, ố bươu um, o buou um",1
5bd3c55e0a83d9001336c5a5,oc_nhay,5b03903306f776d2ff27ae60,5a502b7306f776d2ffa2fea6,2019-02-25T07:44:04Z,2018-10-27T01:54:38Z,FALSE,TRUE,TRUE,food,"ố nhảy, o nhay, ố nhảy hấp, o nhay xao, ố nhảy xào, o nhay hao",1
5bd3c55e0a83d9001336c5a4,oc_dinh,5b03903306f776d2ff27ae60,5b03903306f776d2ff27ae60,2018-11-09T10:17:23Z,2018-10-27T01:54:38Z,FALSE,TRUE,NA,food,"ố đinh, o dinh",0
5bd3c55e89c11d0013cf56e9,oc_da,5b03903306f776d2ff27ae60,5a502b7306f776d2ffa2fea6,2019-02-25T07:39:48Z,2018-10-27T01:54:38Z,FALSE,TRUE,TRUE,food,"ố đá, o da, ố đá xào, o da xao, ố đá hấp, o da hap",1
5bd3c55e40965d0013d4d1fd,che,5b03903306f776d2ff27ae60,5b03903306f776d2ff27ae60,2018-11-09T10:17:23Z,2018-10-27T01:54:38Z,FALSE,TRUE,NA,food,"hè, he, hè á loại, he a loai",0
5bd3c55e89c11d0013cf56e8,mi_miso,5b03903306f776d2ff27ae60,5a502b7306f776d2ffa2fea6,2019-03-02T03:33:36Z,2018-10-27T01:54:38Z,FALSE,TRUE,TRUE,food,"mì miso, mi miso, mỳ miso, my miso, miso ramen",1
5bd3c55e0a83d9001336c5a3,tra_kem_sua,5b03903306f776d2ff27ae60,5b03903306f776d2ff27ae60,2018-11-09T10:17:23Z,2018-10-27T01:54:38Z,FALSE,TRUE,NA,food,"trà kem sữa, tra kem sua",0
5bd3c55e87f9dc00130df830,mochi,5b03903306f776d2ff27ae60,5b03903306f776d2ff27ae60,2018-11-09T10:17:23Z,2018-10-27T01:54:38Z,FALSE,TRUE,NA,food,"mohi, bánh mohi, banh mohi",0
5bd3c55e0a83d9001336c5a2,an_xe,5b03903306f776d2ff27ae60,5a25cd17f36d280fefe391ac,2019-05-02T12:23:13Z,2018-10-27T01:54:38Z,FALSE,FALSE,TRUE,food,"ăn xế, an xe, ăn xế hiều, an xe hieu, an hieu, ăn hiều, hiều",1
5bd3c55e0a83d9001336c5a1,duong_nau,5b03903306f776d2ff27ae60,5b03903306f776d2ff27ae60,2018-11-09T10:17:23Z,2018-10-27T01:54:38Z,FALSE,TRUE,NA,food,"đường nâu, duong nau",0
5bd3c55e40965d0013d4d1fc,mi_quang_thap_cam,5b03903306f776d2ff27ae60,5b03903306f776d2ff27ae60,2018-11-09T10:17:23Z,2018-10-27T01:54:38Z,FALSE,TRUE,NA,food,"mì quảng thập ẩm, mi quang thap am, mỳ quảng thập ẩm, my quang thap am",0
5bd3c55e89c11d0013cf56e7,heo_gia_cay,5b03903306f776d2ff27ae60,5b03903306f776d2ff27ae60,2018-11-09T10:17:23Z,2018-10-27T01:54:38Z,FALSE,TRUE,NA,food,"heo giả ày, heo gia ay",0
5bd3c55e40965d0013d4d1fb,banh_mi_cham,5b03903306f776d2ff27ae60,5b03903306f776d2ff27ae60,2018-11-09T10:17:23Z,2018-10-27T01:54:38Z,FALSE,TRUE,NA,food,"bánh mì hấm, banh mi ham",0
5bd3c55e40965d0013d4d1fa,mon_trung_hoa,5b03903306f776d2ff27ae60,5a502b7306f776d2ffa2fea6,2018-12-21T06:48:36Z,2018-10-27T01:54:38Z,FALSE,TRUE,TRUE,food,"ẩm thự trung hoa, am thu trung hoa, mon trung, món trung, món trung hoa, món trung hoa, đồ ăn trung hoa, đồ ăn trung quố, món ăn trung quố, mon an trung quo, thứ ăn trung quố, thu an trung quo, trung quố, trung quo",1
5bd3c55e40965d0013d4d1f9,banh_mi_thit_nuong,5b03903306f776d2ff27ae60,5b03903306f776d2ff27ae60,2018-11-09T10:17:23Z,2018-10-27T01:54:38Z,FALSE,TRUE,NA,food,"bánh mì thịt nướng, banh mi thit nuong, bánh mỳ thịt nướng, banh my thit nuong",0
5bd3c55e87f9dc00130df82f,banh_ram,5b03903306f776d2ff27ae60,5b03903306f776d2ff27ae60,2018-11-09T10:17:23Z,2018-10-27T01:54:38Z,FALSE,TRUE,NA,food,"bánh ram, banh ram",0
